{

    "version": 2015.1,
    "Timestamp": "2011-07-19T10:34:02",
    "Id": "S2S3050_PO691630-1",
    "Supplier": {
      "PartyId": "0761294001004"
    },
    "SoldTo": {
      "PartyId": "1100001001675"
    },
    "BuyerOrderIds":  [
        "123456",
        "987654",
        "654321"
      ]
    

}